<?xml version="1.0" encoding="UTF-8"?>
<beanlist xmlns:xsi="http://www.w3.org/2001/XMLSchema-instance"
          xsi:noNamespaceSchemaLocation="http://www.vrjuggler.org/tweek/xsd/1.1/beanlist.xsd">
   <service name="PositionalDeviceEditor">
      <file name="${VJ_BASE_DIR}/${VJ_DATA_DIR}/java/CommonEditors.jar"
            class="org.vrjuggler.vrjconfig.commoneditors.PositionalDeviceEditor"/>
      <dependencies>
         <bean>ConfigBroker</bean>
         <jar path="${JCCL_BASE_DIR}/${JCCL_DATA_DIR}/beans">jccl_editors.jar</jar>
         <jar path="${VJ_BASE_DIR}/${TWEEK_DATA_DIR}/java">ui.jar</jar>
         <jar path="${VJ_BASE_DIR}/${VJ_DATA_DIR}/java">jogl-demos-data.jar</jar>
         <jar path="${VJ_BASE_DIR}/${VJ_DATA_DIR}/java">jogl-demos.jar</jar>
         <jar path="${VJ_BASE_DIR}/${VJ_DATA_DIR}/java">jogl-demos-util.jar</jar>
         <jar path="${VJ_BASE_DIR}/${VJ_DATA_DIR}/java">jogl.jar</jar>
      </dependencies>
   </service>
</beanlist>
